{
  "classification": "referral",
  "clinical_notes_excerpt": "Mr. [Patient] is a 60-year-old male with significant cardiac risk factors including hypertension, hyperlipidemia, and a 40 pack-year smoking history who presents with several months of exertional ches",
  "diagnosis_codes": [
    "R07.9"
  ],
  "document_external_id": "REF-001",
  "follow_up_window_days": 22,
  "insurance": {
    "primary": {
      "group_number": null,
      "member_id": "LBC104332181",
      "payer": "Highmark BCBS PA"
    },
    "secondary": null
  },
  "is_degraded": true,
  "missing_fields": [
    "patient.phone"
  ],
  "patient": {
    "address_line1": "33890 Jennifer Squares",
    "city": "Pittsburgh",
    "dob": "1966-03-13",
    "external_id": "PAT-001",
    "first_name": "Amy",
    "last_name": "Robinson",
    "mrn": "MRN-654235",
    "phone": null,
    "state": "PA",
    "zip_code": "15222"
  },
  "procedure_codes": [
    "93015"
  ],
  "referral_type": "stress_test",
  "referring_provider": {
    "external_id": "PRAC-005",
    "first_name": "Shawn",
    "last_name": "Flowers",
    "npi": "2423884966",
    "practice_fax": "878-555-7517",
    "practice_name": "Greater Pittsburgh Primary Care Associates",
    "practice_phone": "878-555-6543"
  },
  "urgency": "routine"
}
