{
  "classification": "referral",
  "clinical_notes_excerpt": "Mr. [Patient] is an 80-year-old gentleman with a significant cardiac risk factor profile including longstanding hypertension who presents with a chief complaint of exertional chest pressure. He report",
  "diagnosis_codes": [
    "R07.9",
    "I10"
  ],
  "document_external_id": "REF-005",
  "follow_up_window_days": 22,
  "insurance": {
    "primary": {
      "group_number": "GRP-4896",
      "member_id": "1QEJ-17K-1822",
      "payer": "Medicare"
    },
    "secondary": null
  },
  "is_degraded": false,
  "missing_fields": [],
  "patient": {
    "address_line1": "346 Kim Path",
    "city": "Washington",
    "dob": "1946-03-05",
    "external_id": "PAT-005",
    "first_name": "Shannon",
    "last_name": "Wright",
    "mrn": "MRN-930103",
    "phone": "878-555-5925",
    "state": "PA",
    "zip_code": "15301"
  },
  "procedure_codes": [
    "93015"
  ],
  "referral_type": "stress_test",
  "referring_provider": {
    "external_id": "PRAC-007",
    "first_name": "Joseph",
    "last_name": "Clark",
    "npi": "4514627049",
    "practice_fax": "412-555-8797",
    "practice_name": "Squirrel Hill Family Practice",
    "practice_phone": "878-555-2927"
  },
  "urgency": "routine"
}
