{
  "classification": "referral",
  "clinical_notes_excerpt": "This 55-year-old male presents with progressive dyspnea over the past three months, initially exertional but now occurring with minimal activity and at rest. He reports associated orthopnea, PND, and ",
  "diagnosis_codes": [
    "I42.9"
  ],
  "document_external_id": "REF-016",
  "follow_up_window_days": 14,
  "insurance": {
    "primary": {
      "group_number": "GRP-2327",
      "member_id": "U531003309",
      "payer": "Cigna"
    },
    "secondary": null
  },
  "is_degraded": false,
  "missing_fields": [],
  "patient": {
    "address_line1": "374 Jackson Rest",
    "city": "Greensburg",
    "dob": "1970-10-04",
    "external_id": "PAT-016",
    "first_name": "Tamara",
    "last_name": "Higgins",
    "mrn": "MRN-496631",
    "phone": "412-555-5947",
    "state": "PA",
    "zip_code": "15601"
  },
  "procedure_codes": [
    "93306"
  ],
  "referral_type": "echo",
  "referring_provider": {
    "external_id": "PRAC-010",
    "first_name": "Sherri",
    "last_name": "Frazier",
    "npi": "7871331501",
    "practice_fax": "724-555-6118",
    "practice_name": "North Hills Medical Group",
    "practice_phone": "878-555-9075"
  },
  "urgency": "routine"
}
