{
  "classification": "referral",
  "clinical_notes_excerpt": "This 58-year-old female presents with a concerning history of unexplained syncope occurring over the past two months. She reports two syncopal episodes without clear prodrome, with rapid return to bas",
  "diagnosis_codes": [
    "I49.5"
  ],
  "document_external_id": "REF-030",
  "follow_up_window_days": 19,
  "insurance": {
    "primary": {
      "group_number": null,
      "member_id": "6204505331",
      "payer": "UnitedHealthcare"
    },
    "secondary": null
  },
  "is_degraded": false,
  "missing_fields": [],
  "patient": {
    "address_line1": "692 Michelle Union Apt. 602",
    "city": "Greensburg",
    "dob": "1967-12-02",
    "external_id": "PAT-010",
    "first_name": "Jill",
    "last_name": "Cook",
    "mrn": "MRN-421607",
    "phone": "724-555-2287",
    "state": "PA",
    "zip_code": "15601"
  },
  "procedure_codes": [
    "93620"
  ],
  "referral_type": "ep_study",
  "referring_provider": {
    "external_id": "PRAC-002",
    "first_name": "Lisa",
    "last_name": "Smith",
    "npi": "8161849590",
    "practice_fax": "412-555-7527",
    "practice_name": "Highland Park Family Practice",
    "practice_phone": "412-555-1139"
  },
  "urgency": "stat"
}
